398,431.0,458.0,441.0,889.0,99,25Q670,Q,25,670,ROBERT F. KENNEDY COMMUNITY HIGH SCHOOL,11366,Kew Gardens Hills,76377,40.725603,-73.810697
399,379.0,421.0,377.0,800.0,7,25Q792,Q,25,792,NORTH QUEENS COMMUNITY HIGH SCHOOL,11367,Kew Gardens Hills,53564,40.720359,-73.819792
400,480.0,545.0,489.0,1025.0,888,26Q415,Q,26,415,BENJAMIN N. CARDOZO HIGH SCHOOL,11364,Oakland Gardens,65776,40.752333,-73.75599
401,468.0,539.0,467.0,1007.0,934,26Q430,Q,26,430,FRANCIS LEWIS HIGH SCHOOL,11365,Auburndale,61097,40.740724,-73.79283
402,391.0,397.0,384.0,788.0,334,26Q435,Q,26,435,MARTIN VAN BUREN HIGH SCHOOL,11427,Bellerose,57224,40.733066,-73.738756
403,462.0,523.0,464.0,985.0,708,26Q495,Q,26,495,BAYSIDE HIGH SCHOOL,11361,Bayside-Bayside Hills,70983,40.771755,-73.780296
404,425.0,434.0,420.0,859.0,175,26Q566,Q,26,566,"QUEENS HIGH SCHOOL OF TEACHING, LIBERAL ARTS AND THE SCIENCES",11426,Bellerose,74452,40.746088,-73.727535
405,387.0,385.0,373.0,772.0,87,27Q260,Q,27,260,FREDERICK DOUGLASS ACADEMY VI HIGH SCHOOL,11691,Far Rockaway-Bayswater,35645,40.60201,-73.762795
406,432.0,419.0,401.0,851.0,74,27Q262,Q,27,262,CHANNEL VIEW SCHOOL FOR RESEARCH,11694,Breezy Point-Belle Harbor-Rockaway Park-Broad Channel,75157,40.586066,-73.822624
407,391.0,401.0,364.0,792.0,44,27Q302,Q,27,302,"QUEENS HIGH SCHOOL FOR INFORMATION, RESEARCH, AND TECHNOLOGY",11691,Far Rockaway-Bayswater,35645,40.60201,-73.762795
408,423.0,426.0,416.0,849.0,93,27Q308,Q,27,308,ROBERT H. GODDARD HIGH SCHOOL OF COMMUNICATION ARTS AND TECHNOLOGY,11417,Ozone Park,56102,40.67124,-73.845141
409,367.0,379.0,348.0,746.0,36,27Q309,Q,27,309,ACADEMY OF MEDICAL TECHNOLOGY: A COLLEGE BOARD SCHOOL,11691,Far Rockaway-Bayswater,35645,40.60201,-73.762795
410,499.0,537.0,496.0,1036.0,89,27Q323,Q,27,323,SCHOLARS' ACADEMY,11694,Breezy Point-Belle Harbor-Rockaway Park-Broad Channel,75157,40.584109,-73.825711
411,377.0,371.0,360.0,748.0,101,27Q400,Q,27,400,AUGUST MARTIN HIGH SCHOOL,11434,Springfield Gardens North,51640,40.675633,-73.783342
412,384.0,396.0,354.0,780.0,78,27Q410,Q,27,410,BEACH CHANNEL HIGH SCHOOL,-,-,-,-,-
413,382.0,404.0,368.0,786.0,404,27Q475,Q,27,475,RICHMOND HILL HIGH SCHOOL,11418,Richmond Hill,57063,40.695888,-73.833681
414,391.0,409.0,392.0,800.0,403,27Q480,Q,27,480,JOHN ADAMS HIGH SCHOOL,11417,South Ozone Park,56102,40.679639,-73.837298
415,429.0,491.0,425.0,920.0,194,27Q650,Q,27,650,"HIGH SCHOOL FOR CONSTRUCTION TRADES, ENGINEERING AND ARCHITECTURE",11416,Richmond Hill,46712,40.689591,-73.840717
416,,,,,s,28Q284,Q,28,284,YORK EARLY COLLEGE ACADEMY,11433,South Jamaica,41780,40.69719,-73.787192
417,420.0,445.0,400.0,865.0,68,28Q310,Q,28,310,QUEENS COLLEGIATE: A COLLEGE BOARD SCHOOL,11432,Briarwood-Jamaica Hills,50291,40.713218,-73.797237
418,,,,,s,28Q325,Q,28,325,HILLSIDE ARTS & LETTERS ACADEMY,11432,Briarwood-Jamaica Hills,50291,40.713218,-73.797237
419,403.0,408.0,367.0,811.0,6,28Q338,Q,28,338,QUEENS SATELLITE HIGH SCHOOL FOR OPPORTUNITY,11432,Jamaica,50291,40.70848,-73.800065
420,430.0,452.0,425.0,882.0,25,28Q350,Q,28,350,JAMAICA GATEWAY TO THE SCIENCES,11432,Briarwood-Jamaica Hills,50291,40.713218,-73.797237
421,456.0,497.0,454.0,953.0,762,28Q440,Q,28,440,FOREST HILLS HIGH SCHOOL,11375,Forest Hills,69446,40.729402,-73.845637
422,342.0,368.0,353.0,710.0,90,28Q470,Q,28,470,JAMAICA HIGH SCHOOL,-,-,-,-,-
423,395.0,413.0,386.0,808.0,462,28Q505,Q,28,505,HILLCREST HIGH SCHOOL,11432,Briarwood-Jamaica Hills,50291,40.709446,-73.80166
424,452.0,478.0,442.0,930.0,422,28Q620,Q,28,620,THOMAS A. EDISON CAREER AND TECHNICAL EDUCATION HIGH SCHOOL,11432,Briarwood-Jamaica Hills,50291,40.715389,-73.800369
425,513.0,523.0,502.0,1036.0,99,28Q680,Q,28,680,QUEENS GATEWAY TO HEALTH SCIENCES SECONDARY SCHOOL,11432,Pomonok-Flushing Heights-Hillcrest,50291,40.718831,-73.806499
426,,,,,s,28Q686,Q,28,686,QUEENS METROPOLITAN HIGH SCHOOL,11375,Forest Hills,69446,40.711367,-73.856698
427,612.0,660.0,596.0,1272.0,121,28Q687,Q,28,687,QUEENS HIGH SCHOOL FOR THE SCIENCES AT YORK COLLEGE,11433,Jamaica,41780,40.701049,-73.798151
428,406.0,406.0,384.0,812.0,74,28Q690,Q,28,690,HIGH SCHOOL FOR LAW ENFORCEMENT AND PUBLIC SAFETY,11434,Baisley Park,51640,40.686208,-73.784144
429,439.0,445.0,432.0,884.0,68,28Q896,Q,28,896,"YOUNG WOMEN'S LEADERSHIP SCHOOL, QUEENS",11432,Briarwood-Jamaica Hills,50291,40.707527,-73.806412
430,360.0,380.0,359.0,740.0,52,29Q248,Q,29,248,QUEENS PREPARATORY ACADEMY,11413,Springfield Gardens North,77058,40.668235,-73.756839
431,401.0,397.0,375.0,798.0,46,29Q259,Q,29,259,PATHWAYS COLLEGE PREPARATORY SCHOOL: A COLLEGE BOARD SCHOOL,11412,Hollis,67395,40.70646,-73.753579
432,402.0,398.0,402.0,800.0,49,29Q265,Q,29,265,EXCELSIOR PREPARATORY HIGH SCHOOL,11413,Springfield Gardens North,77058,40.668235,-73.756839
433,436.0,427.0,424.0,863.0,59,29Q272,Q,29,272,GEORGE WASHINGTON CARVER HIGH SCHOOL FOR THE SCIENCES,11413,Springfield Gardens North,77058,40.668235,-73.756839
434,370.0,367.0,363.0,737.0,43,29Q283,Q,29,283,PREPARATORY ACADEMY FOR WRITERS: A COLLEGE BOARD SCHOOL,11413,Springfield Gardens North,77058,40.668235,-73.756839
435,,,,,s,29Q326,Q,29,326,CAMBRIA HEIGHTS ACADEMY,11423,Jamaica,64756,40.711849,-73.771195
436,400.0,426.0,394.0,826.0,78,29Q492,Q,29,492,"MATHEMATICS, SCIENCE RESEARCH AND TECHNOLOGY MAGNET HIGH SCHOOL",11411,Cambria Heights,69131,40.697819,-73.745728
437,385.0,377.0,377.0,762.0,52,29Q494,Q,29,494,"LAW, GOVERNMENT AND COMMUNITY SERVICE HIGH SCHOOL",-,-,-,-,-
438,379.0,414.0,359.0,793.0,49,29Q496,Q,29,496,"BUSINESS, COMPUTER APPLICATIONS & ENTREPRENEURSHIP HIGH SCHOOL",-,-,-,-,-
439,393.0,381.0,377.0,774.0,62,29Q498,Q,29,498,HUMANITIES & ARTS MAGNET HIGH SCHOOL,11411,Cambria Heights,69131,40.697819,-73.745728
440,,,,,s,30Q286,Q,30,286,"YOUNG WOMEN'S LEADERSHIP SCHOOL, ASTORIA",11102,Old Astoria,48399,40.771215,-73.924591
441,410.0,440.0,405.0,850.0,98,30Q301,Q,30,301,ACADEMY FOR CAREERS IN TELEVISION AND FILM,11101,Hunters Point-Sunnyside-West Maspeth,39955,40.742956,-73.959196
442,414.0,449.0,412.0,863.0,395,30Q445,Q,30,445,WILLIAM CULLEN BRYANT HIGH SCHOOL,11103,Astoria,52494,40.75823,-73.910514
443,403.0,420.0,395.0,823.0,392,30Q450,Q,30,450,LONG ISLAND CITY HIGH SCHOOL,11106,Astoria,44030,40.765826,-73.9328
444,504.0,496.0,494.0,1000.0,174,30Q501,Q,30,501,FRANK SINATRA SCHOOL OF THE ARTS HIGH SCHOOL,11106,Astoria,44030,40.756534,-73.925121
445,407.0,434.0,398.0,841.0,148,30Q502,Q,30,502,INFORMATION TECHNOLOGY HIGH SCHOOL,11101,Hunters Point-Sunnyside-West Maspeth,39955,40.748701,-73.94638
446,323.0,475.0,329.0,798.0,143,30Q555,Q,30,555,NEWCOMERS HIGH SCHOOL,11101,Queensbridge-Ravenswood-Long Island City,39955,40.751356,-73.937445
447,487.0,492.0,491.0,979.0,135,30Q575,Q,30,575,ACADEMY OF AMERICAN STUDIES,11101,Queensbridge-Ravenswood-Long Island City,39955,40.751331,-73.937434
448,524.0,568.0,544.0,1092.0,61,30Q580,Q,30,580,BACCALAUREATE SCHOOL FOR GLOBAL EDUCATION,11106,Queensbridge-Ravenswood-Long Island City,44030,40.755366,-73.927169
449,452.0,451.0,450.0,903.0,137,31R047,R,31,047,CSI HIGH SCHOOL FOR INTERNATIONAL STUDIES,10314,Todt Hill-Emerson Hill-Heartland Village-Lighthouse Hill,78413,40.581315,-74.158589
450,398.0,412.0,385.0,810.0,61,31R064,R,31,064,GAYNOR MCCOWN EXPEDITIONARY LEARNING SCHOOL,10314,Todt Hill-Emerson Hill-Heartland Village-Lighthouse Hill,78413,40.581315,-74.158589
451,472.0,488.0,466.0,960.0,107,31R080,R,31,080,THE MICHAEL J. PETRIDES SCHOOL,10301,Todt Hill-Emerson Hill-Heartland Village-Lighthouse Hill,56776,40.608517,-74.102078
452,424.0,437.0,416.0,861.0,391,31R440,R,31,440,NEW DORP HIGH SCHOOL,10306,New Dorp-Midland Beach,75212,40.569393,-74.107737
453,424.0,438.0,417.0,862.0,271,31R445,R,31,445,PORT RICHMOND HIGH SCHOOL,10302,Port Richmond,59919,40.634573,-74.141818
454,437.0,435.0,429.0,872.0,375,31R450,R,31,450,CURTIS HIGH SCHOOL,10301,West New Brighton-New Brighton-St. George,56776,40.644735,-74.081222
455,462.0,486.0,470.0,948.0,807,31R455,R,31,455,TOTTENVILLE HIGH SCHOOL,10312,Annadale-Huguenot-Prince's Bay-Eltingville,84524,40.528092,-74.192032
456,455.0,474.0,459.0,929.0,535,31R460,R,31,460,SUSAN E. WAGNER HIGH SCHOOL,10314,Todt Hill-Emerson Hill-Heartland Village-Lighthouse Hill,78413,40.596803,-74.124227
457,466.0,455.0,414.0,921.0,10,31R470,R,31,470,CONCORD HIGH SCHOOL,10304,Grymes Hill-Clifton-Fox Hills,46260,40.610868,-74.087379
458,416.0,422.0,397.0,838.0,94,31R600,R,31,600,RALPH R. MCKEE CAREER AND TECHNICAL EDUCATION HIGH SCHOOL,10301,West New Brighton-New Brighton-St. George,56776,40.642793,-74.07873
459,635.0,682.0,636.0,1317.0,227,31R605,R,31,605,STATEN ISLAND TECHNICAL HIGH SCHOOL,10306,New Dorp-Midland Beach,75212,40.567873,-74.115373
460,405.0,375.0,370.0,780.0,10,31R607,R,31,607,YOUNG ADULT BOROUGH CENTER AT STATEN IS TECH HS,-,-,-,-,-
461,380.0,366.0,352.0,746.0,50,32K403,K,32,403,ACADEMY FOR ENVIRONMENTAL LEADERSHIP,11237,Bushwick North,35354,40.69697,-73.910791
462,384.0,409.0,361.0,793.0,88,32K545,K,32,545,EBC HIGH SCHOOL FOR PUBLIC SERVICEBUSHWICK,11221,Bushwick South,34005,40.694507,-73.929107
463,348.0,353.0,334.0,701.0,75,32K549,K,32,549,BUSHWICK SCHOOL FOR SOCIAL JUSTICE,11237,Bushwick North,35354,40.69697,-73.910791
464,342.0,364.0,354.0,706.0,67,32K552,K,32,552,ACADEMY OF URBAN PLANNING,11237,Bushwick North,35354,40.69697,-73.910791
465,428.0,465.0,422.0,893.0,39,32K554,K,32,554,ALL CITY LEADERSHIP SECONDARY SCHOOL,11237,Bushwick North,35354,40.69737,-73.913171
466,347.0,358.0,350.0,705.0,23,32K556,K,32,556,BUSHWICK LEADERS HIGH SCHOOL FOR ACADEMIC EXCELLENCE,11221,Bushwick South,34005,40.695056,-73.92814
467,359.0,317.0,358.0,676.0,24,32K564,K,32,564,BUSHWICK COMMUNITY HIGH SCHOOL,11221,Bushwick North,34005,40.695362,-73.915142
468,,,,,s,75K371,K,75,371,P.S. 371 s LILLIAN L. RASHKIS,11232,Sunset Park West,34807,40.654293,-74.005889
469,,,,,s,75M035,M,75,035,P.S. 035,10019,Clinton,84786,40.763866,-73.985939
470,,,,,s,75Q256,Q,75,256,P.S. Q256,11791,-,136222,,
471,429.0,444.0,433.0,873.0,32,75Q811,Q,75,811,P.S. Q811,11362,Douglas Manor-Douglaston-Little Neck,74826,40.756778,-73.729487
472,,,,,s,75R025,R,75,025,SOUTH RICHMOND HIGH SCHOOL I.S./P.S. 25,10309,Annadale-Huguenot-Prince's Bay-Eltingville,84917,40.508809,-74.222403
473,,,,,s,75X012,X,75,012,P.S. X012 LEWIS AND CLARK SCHOOL,10461,Van Nest-Morris Park-Westchester Square,47715,40.840145,-73.844419
474,,,,,s,75X754,X,75,754,J. M. RAPPORT SCHOOL CAREER DEVELOPMENT,10455,Mott Haven-Port Morris,22828,40.811162,-73.909804
475,,,,,s,79M645,M,79,645,SCHOOL FOR COOPERATIVE TECHNICAL EDUCATION,-,-,-,-,-
476,496.0,400.0,426.0,896.0,8,79Q950,Q,79,950,GED PLUS s CITYWIDE,-,-,-,-,-
477,367.0,370.0,360.0,737.0,9,79X490,X,79,490,PHOENIX ACADEMY,-,-,-,-,-
